ID,Field_10_0_2_46479_000_lang,Field_10_0_2_46479_001_lang,Field_10_0_2_46479_002_lang,Field_10_0_2_46479_003_lang,Field_10_0_2_46479_004_lang,Field_10_0_2_46479_005_lang,Field_10_0_2_46479_006_lang,Field_10_0_2_46479_007,Field_10_0_2_46479_008,Field_10_0_2_46479_009,Field_10_0_2_46479_010,Field_10_0_2_46479_011,Field_10_0_2_46479_012,Field_10_0_2_46479_013,Field_10_0_2_46479_014,Field_10_0_2_46479_015,Field_10_0_2_46479_016,Field_10_0_2_46479_017
1,[PH] This is some text telling the player how to use this UI!,Purificar reforjador,Elimina el beneficio y el efecto secundario de un objeto corrupto,Purificar,,,,5272,115219,115220,32,0,13262,0,1,0,0,0
2,[PH] This is some text telling the player how to use this UI!,Purificar reforjador,Elimina el beneficio y el efecto secundario de un objeto corrupto,Purificar,,,,5272,115219,115220,32,0,0,0,2,8560,8560,0
3,"Coloca un objeto corrupto aquí y haz clic en ""Purificar"" para eliminar el efecto al equiparlo y la corrupción del objeto.",Purificación titánica,Elimina el efecto al equiparlo y la corrupción de un objeto corrupto,Purificar,,,,5272,115219,115220,5,0,0,1719,2,146817,146814,0
4,Destruye un objeto legendario para recuperar su esencia de alma,Grabador de Runas,Recibirás:,Destruir,Destruye un objeto legendario para recuperar su esencia de alma,¿Seguro que quieres destruir permanentemente este objeto legendario para recuperar su esencia de alma?,,5412,0,0,0,3,0,0,3,0,188155,0
5,Transforma un objeto normal en un objeto de conjunto,Catalizador de creación,"Transforma un objeto en un objeto de conjunto. Solo los objetos para la cabeza, los hombros, el torso, las manos y las piernas otorgan bonus.",Transformar,Transforma un objeto normal en un objeto de bonus de conjunto,¿Seguro que quieres gastar %s %s para mejorar este objeto? Mejorar este objeto provocará que se ligue.,Introduce un objeto válido de la temporada 4 de Shadowlands,5429,0,0,1,47,0,2000,4,193474,193476,2
6,Transforma un objeto normal en un objeto de conjunto,Catalizador de reanimación,"Transforma un objeto en un objeto de conjunto. Solo los objetos para la cabeza, los hombros, el torso, las manos y las piernas otorgan bonus.",Transformar,Transforma un objeto normal en un objeto de bonus de conjunto,¿Seguro que quieres gastar %s %s para mejorar este objeto? Mejorar este objeto provocará que se ligue al alma.,Introduce un objeto válido de la temporada 1 de Dragonflight,5429,0,0,1,31,0,2167,4,213971,213970,3
