ID,Field_10_0_2_46479_000_lang,Field_10_0_2_46479_001_lang,Field_10_0_2_46479_002_lang,Field_10_0_2_46479_003_lang,Field_10_0_2_46479_004_lang,Field_10_0_2_46479_005_lang,Field_10_0_2_46479_006_lang,Field_10_0_2_46479_007,Field_10_0_2_46479_008,Field_10_0_2_46479_009,Field_10_0_2_46479_010,Field_10_0_2_46479_011,Field_10_0_2_46479_012,Field_10_0_2_46479_013,Field_10_0_2_46479_014,Field_10_0_2_46479_015,Field_10_0_2_46479_016,Field_10_0_2_46479_017
1,[PH] This is some text telling the player how to use this UI!,Очищение и перековка,Рассеивает положительный и побочный эффекты пораженного порчей предмета.,Очищение,,,,5272,115219,115220,32,0,13262,0,1,0,0,0
2,[PH] This is some text telling the player how to use this UI!,Очищение и перековка,Рассеивает положительный и побочный эффекты пораженного порчей предмета.,Очищение,,,,5272,115219,115220,32,0,0,0,2,8560,8560,0
3,"Поместите зараженный предмет в гнездо и нажмите кнопку ""Очистить"", чтобы снять с него порчу. Очищенный предмет больше не становится персональным при надевании.",Очищение титанов,Снимает порчу с зараженного предмета. Очищенный предмет больше не становится персональным при надевании.,Очищение,,,,5272,115219,115220,5,0,0,1719,2,146817,146814,0
4,"Уничтожает легендарный предмет, извлекая сущность души.",Резчик Рун,Вы получите:,Уничтожение,"Уничтожает легендарный предмет, извлекая субстанцию души.",Вы действительно хотите извлечь сущность души из легендарного предмета? Данный предмет будет уничтожен.,,5412,0,0,0,3,0,0,3,0,188155,0
5,Превращает обычный предмет в предмет из комплекта,Катализатор творения,"Превращает предмет в предмет из комплекта. Бонусы комплектов можно активировать только с помощью шлемов, наплечников, нагрудных доспехов, перчаток и поножей.",Превращение,Превращает обычный предмет в предмет с бонусом комплекта,Улучшить указанный предмет? Стоимость улучшения: %s %s. После улучшения предмет станет персональным.,Вставьте подходящий предмет из 4-го сезона Shadowlands,5429,0,0,1,47,0,2000,4,193474,193476,2
6,Превращает обычный предмет в предмет из комплекта,Катализатор возрождения,"Превращает предмет в предмет из комплекта. Бонусы комплектов можно активировать только с помощью шлемов, наплечников, нагрудных доспехов, перчаток и поножей.",Превращение,Превращает обычный предмет в предмет с бонусом комплекта,Улучшить указанный предмет? Стоимость улучшения: %s %s. После улучшения предмет станет персональным.,Вставьте подходящий предмет из 1-го сезона Dragonflight,5429,0,0,1,31,0,2167,4,213971,213970,3
