ID,Field_10_0_2_46479_000_lang,Field_10_0_2_46479_001_lang,Field_10_0_2_46479_002_lang,Field_10_0_2_46479_003_lang,Field_10_0_2_46479_004_lang,Field_10_0_2_46479_005_lang,Field_10_0_2_46479_006_lang,Field_10_0_2_46479_007,Field_10_0_2_46479_008,Field_10_0_2_46479_009,Field_10_0_2_46479_010,Field_10_0_2_46479_011,Field_10_0_2_46479_012,Field_10_0_2_46479_013,Field_10_0_2_46479_014,Field_10_0_2_46479_015,Field_10_0_2_46479_016,Field_10_0_2_46479_017
1,[PH] This is some text telling the player how to use this UI!,Läuterungsumschmieder,Entfernt den Bonus sowie die Nebenwirkung eines verderbten Gegenstands.,Läuterung,,,,5272,115219,115220,32,0,13262,0,1,0,0,0
2,[PH] This is some text telling the player how to use this UI!,Läuterungsumschmieder,Entfernt den Bonus sowie die Nebenwirkung eines verderbten Gegenstands.,Läuterung,,,,5272,115219,115220,32,0,0,0,2,8560,8560,0
3,"Platziert einen verderbten Gegenstand hier und klickt auf Läutern, um sowohl den Ausrüstungsbonus als auch die Verderbnis des Gegenstands zu entfernen.",Titanische Läuterung,Entfernt den Ausrüstungsbonus sowie die Verderbnis eines verderbten Gegenstands.,Läutern,,,,5272,115219,115220,5,0,0,1719,2,146817,146814,0
4,"Zerstört einen legendären Gegenstand, um seine Seelenessenz zurückzuerhalten.",Runenmetz,Ihr bekommt:,Zerstören,"Zerstört einen legendären Gegenstand, um seine Seelenessenz zurückzuerhalten.","Seid Ihr Euch sicher, dass Ihr diesen legendären Gegenstand dauerhaft zerstören möchtet, um seine Seelenessenz zurückzuerhalten?",,5412,0,0,0,3,0,0,3,0,188155,0
5,Verwandelt einen regulären Gegenstand in einen Setgegenstand,Schöpfungskatalysator,"Verwandelt einen Gegenstand in einen Setgegenstand. Nur Kopf, Schulter, Brust, Hände und Beine bieten Boni.",Verwandeln,Verwandelt einen regulären Gegenstand in einen Gegenstand mit Setbonus,"Seid Ihr sicher, dass Ihr %s %s ausgeben wollt, um folgenden Gegenstand aufzuwerten? Durch das Aufwerten wird dieser Gegenstand seelengebunden.",Legt einen passenden Gegenstand aus Saison 4 von Shadowlands ein,5429,0,0,1,47,0,2000,4,193474,193476,2
6,Verwandelt einen regulären Gegenstand in einen Setgegenstand,Belebungskatalysator,"Verwandelt einen Gegenstand in einen Setgegenstand. Nur Kopf, Schulter, Brust, Hände und Beine bieten Boni.",Verwandeln,Verwandelt einen regulären Gegenstand in einen Gegenstand mit Setbonus,"Seid Ihr sicher, dass Ihr %s %s ausgeben wollt, um folgenden Gegenstand aufzuwerten? Durch das Aufwerten wird dieser Gegenstand seelengebunden.",Legt einen passenden Gegenstand aus Saison 1 von Dragonflight ein,5429,0,0,1,31,0,2167,4,213971,213970,3
